statement,source,url,date,category
"India achieved 241 GW peak power demand on June 9, 2025 with zero shortage",PIB India,https://pib.gov.in/sample,2025-06-10,energy
The Ayushman Bharat scheme provides health coverage of up to Rs 5 lakh per family per year,PIB India,https://pib.gov.in/sample,2025-01-15,healthcare
IREDA was granted Navratna status by the Government of India,PIB India,https://pib.gov.in/sample,2025-03-20,business
India has 28 states and 8 union territories as of 2024,Government of India,https://india.gov.in,2024-01-01,geography
The Digital India initiative was launched in 2015,PIB India,https://pib.gov.in/sample,2015-07-01,technology
